text,person,fiction_or_not
"Ye[a] (/jeɪ/ YAY; born Kanye Omari West /ˈkɑːnjeɪ/ KAHN-yay; June 8, 1977) is an American rapper, singer, songwriter, record producer, and fashion designer. One of the most prominent figures in hip hop,[3] he is known for his varying musical style[4] and polarizing cultural and political commentary.[5] After dropping out of college to pursue a career in music, West began producing for regional artists in the Chicago area. As an in-house producer for Roc-A-Fella Records, he co-produced albums including Jay-Z's The Blueprint (2001) before signing with the label as a recording artist. West's debut studio album, The College Dropout (2004), was met with critical acclaim and yielded the Billboard Hot 100-number one single ""Slow Jamz"". He peaked the chart on four other occasions with the singles ""Gold Digger"" (2005), ""Stronger"" (2007), ""E.T."" (2011, as a featured artist), and ""Carnival"" (2024).",kanye.txt,True
"West's second and third studio albums, Late Registration (2005) and Graduation (2007), both debuted atop the Billboard 200, the latter becoming West's most commercially successful to date. Three of his subsequent albums, 808s & Heartbreak (2008), My Beautiful Dark Twisted Fantasy (2010), and The Life of Pablo (2016), were certified triple platinum, and Yeezus (2013) was certified double platinum. While not as well-received critically as his previous efforts, Ye (2018), Jesus Is King (2019), and Donda (2021) continued West's series of consecutive number one debuts on the Billboard 200. West has also released the collaborative albums Watch the Throne (2011) with Jay-Z, Kids See Ghosts (2018) with Kid Cudi, and Vultures 1 and Vultures 2 (2024) with Ty Dolla Sign. In fashion design, he has collaborated with Nike, Inc., Louis Vuitton, and Gap Inc. on clothing and footwear, and led the Yeezy collaboration with Adidas.",kanye.txt,True
"One of the world's best-selling music artists with 160 million records sold, West has won 24 Grammy Awards, the joint 11th-most of all time and most awarded for any hip hop artist along with Jay-Z.[6] His other accolades include a Billboard Artist Achievement Award, a joint-record three Brit Awards for Best International Male Solo Artist, and the Michael Jackson Video Vanguard Award.[7] West holds the joint record (with Bob Dylan) for most albums (4) topping the annual Pazz & Jop critic poll. Time named him one of the 100 most influential people in the world in 2005 and 2015.[8][9] West's first six solo albums were included on Rolling Stone's 500 Greatest Albums of All Time list in 2020, with the same publication naming him one of the 100 Greatest Songwriters of All Time.[10]",kanye.txt,True
"West's outspoken views have received significant media coverage. He has been a frequent source of controversy due to his conduct on social media, at award shows and public settings, as well as his comments on the music and fashion industries, U.S. politics, race, and slavery. His Christian faith, high-profile marriage to Kim Kardashian, and mental health have also been topics of media attention.[11][12][13] In 2020, West launched an unsuccessful independent presidential campaign that advocated for a consistent life ethic. In October 2022, he was widely condemned and lost many sponsors and partnerships—including his collaborations with Adidas, Gap, and Balenciaga—after making a series of antisemitic statements, including denying the Holocaust.",kanye.txt,True
Early life,kanye.txt,True
"West was born on June 8, 1977, in Atlanta, Georgia.[c] After his parents divorced when he was three years old, he moved with his mother to Chicago, Illinois.[16][17] His father, Ray West, is a former Black Panther and was one of the first black photojournalists at The Atlanta Journal-Constitution. Ray later became a Christian counselor,[17] and in 2006, opened the Good Water Store and Café in Lexington Park, Maryland, with startup capital from his son.[18][19] West's mother, Donda C. West (née Williams),[20] was a professor of English at Clark Atlanta University and the Chair of the English Department at Chicago State University before retiring to serve as his manager.",kanye.txt,True
"West was raised in a middle-class environment, attending Polaris School for Individual Education[21] in suburban Oak Lawn, Illinois, after living in Chicago.[22] At the age of 10, West moved with his mother to Nanjing, China, where she was teaching at Nanjing University as a Fulbright Scholar.[23] According to his mother, West was the only foreigner in his class, but he settled in well and quickly picked up the language, although he has since forgotten most of it.[24] When asked about his grades in high school, West replied, ""I got A's and B's.""[25]",kanye.txt,True
"West demonstrated an affinity for the arts at an early age; he began writing poetry when he was five years old.[26] West started rapping in the third grade and began making musical compositions in the seventh grade, eventually selling them to other artists.[27] West crossed paths with producer No I.D., who became West's friend and mentor.[28]: 557  After graduating from high school, West received a scholarship to attend Chicago's American Academy of Art in 1997 and began taking painting classes. Shortly after, he transferred to Chicago State University to study English. At age 20, he dropped out to pursue his musical career.[29] This greatly displeased his mother, who was also a professor at the university, although she would later accept the decision.[28]: 558",kanye.txt,True
Musical career,kanye.txt,True
1996–2002: Early work and Roc-A-Fella,kanye.txt,True
"West began his early production career in the mid-1990s, creating beats primarily for burgeoning local artists in the Chicago area. He received his first official production credits at age nineteen, when he produced eight tracks on Down to Earth, the 1996 debut album of Chicago-based underground rapper Grav.[30] In 1998, West was the first producer signed to the management-production company Hip Hop Since 1978, founded by Gee Roberson and Kyambo ""Hip-Hop"" Joshua.[31] For a time, West acted as a ghost producer for Deric ""D-Dot"" Angelettie. Due to his association with Angelettie, West was not able to release a solo album, so he formed the Go-Getters, a hip hop group composed of him and fellow Chicago natives GLC, Timmy G, Really Doe, and Arrowstar.[32][33] The Go-Getters independently released their first and only studio album, World Record Holders in 1999 through West's company, Konman Productions.[32] West spent much of the late 1990s further producing for several musical acts.[34] He produced the third track on Foxy Brown's second studio album Chyna Doll (1999), which became the second hip-hop album by a female rapper to peak atop the US Billboard 200 chart.[34]",kanye.txt,True
West received early acclaim for his production work on Jay-Z's The Blueprint. The two are pictured here in 2011.,kanye.txt,True
"In 2000, West began producing for artists on Roc-A-Fella Records as an in-house producer. West is often credited with revitalizing Jay-Z's career with extensive contributions to his 2001 album The Blueprint,[35] which Rolling Stone ranked among their list of greatest hip-hop albums.[36] West produced songs for label cohorts such as Beanie Sigel and Freeway, but also produced beats which were used by artists on other labels including Ludacris, Alicia Keys, and Janet Jackson.[35][37] Meanwhile, West struggled to attain a record deal as a rapper.[38] Multiple record companies, including Capitol Records,[27] denied or ignored him because he did not portray the gangsta image prominent in mainstream hip hop at the time.[28]: 556  Desperate to keep West from defecting to another label, then-label head Damon Dash reluctantly signed West to Roc-A-Fella as a recording artist.[28]: 556 [39]",kanye.txt,True
"A 2002 car accident, which shattered his jaw,[40][41] inspired West; two weeks after being admitted to the hospital, he recorded ""Through the Wire"" at the Record Plant Studios with his jaw still wired shut.[40] The song was first included on West's debut mixtape Get Well Soon..., which was released in December 2002.[42] At the same time, West announced that he was working on an album titled The College Dropout, whose overall theme was to ""make your own decisions. Don't let society tell you, 'This is what you have to do.'""[43]",kanye.txt,True
2003–2006: The College Dropout and Late Registration,kanye.txt,True
Main articles: The College Dropout and Late Registration,kanye.txt,True
West in Portland in December 2005 as a supporting act for U2 on their Vertigo Tour,kanye.txt,True
"West recorded the remainder of the album in Los Angeles while recovering from the car accident. It was leaked months before its release date,[38] and West used the opportunity to remix, remaster, and revise the album before its release;[44] West added new verses, string arrangements, gospel choirs, and improved drum programming.[38] The album was postponed three times from its initial date in August 2003,[45][46] and was eventually released in February 2004, reaching No. 2 on the Billboard 200 as his debut single, ""Through the Wire"" peaked at No. 15 while on the Billboard Hot 100 chart for five weeks.[47] ""Slow Jamz"", his second single, featuring Twista and Jamie Foxx, became the three musicians' first No. 1 hit. The College Dropout received critical acclaim, was nominated for the top album of the year by American Music Awards and Billboard,[48][49] and has consistently been ranked among the great hip-hop works and debut albums by artists.[50][51]",kanye.txt,True
"""Jesus Walks"", the album's fourth single, reached the top 20 of the Billboard pop charts, despite industry executives' predictions that a song containing such blatant declarations of faith would never make it to the radio.[50][51] The College Dropout was certified triple platinum in the U.S., and garnered West 10 Grammy nominations, including Album of the Year, and Best Rap Album (which it received).[52] During this period, West founded GOOD Music, a record label and management company that housed affiliate artists and producers, such as No I.D. and John Legend,[53] and produced singles for Brandy, Common, Legend, and Slum Village.[54]",kanye.txt,True
"West invested $2 million and took over a year to make his second album.[55] West was inspired by Roseland NYC Live, a 1998 live album by English trip hop group Portishead, produced with the New York Philharmonic Orchestra,[56] incorporating string arrangements into his hip-hop production. Though West had not been able to afford many live instruments around the time of his debut album, the money from his commercial success enabled him to hire a string orchestra for his second album Late Registration.[56] West collaborated with American film score composer Jon Brion, who served as the album's co-executive producer for several tracks.[57][58] Late Registration sold over 2.3 million units in the United States alone by the end of 2005 and was considered by industry observers as the only successful major album release of the fall season, which had been plagued by steadily declining CD sales.[59]",kanye.txt,True
"When his song ""Touch the Sky"" failed to win Best Video at the 2006 MTV Europe Music Awards, West went onto the stage as the award was being presented to Justice and Simian for ""We Are Your Friends"" and argued that he should have won the award instead.[60][61] Hundreds of news outlets worldwide criticized the outburst. On November 7, 2006, West apologized for this outburst publicly during his performance as support act for U2 for their Vertigo concert in Brisbane.[62] He later spoofed the incident on the 33rd-season premiere of Saturday Night Live in September 2007.[63]",kanye.txt,True
"2007–2009: Graduation, 808s & Heartbreak, and VMAs incident",kanye.txt,True
"Main articles: Graduation (album), 808s & Heartbreak, and Kanye West MTV Video Music Awards controversy",kanye.txt,True
"West's third studio album, Graduation, garnered major publicity when its release date pitted West in a sales competition against rapper 50 Cent's Curtis.[64] Upon their September 2007 releases, Graduation outsold Curtis by a large margin, debuting at number one on the U.S. Billboard 200 chart and selling 957,000 copies in its first week.[65] Graduation continued the string of critical and commercial successes by West, and the album's lead single, ""Stronger"", garnered his third number-one hit.[66] ""Stronger"", which samples French house duo Daft Punk, has been accredited to not only encouraging other hip-hop artists to incorporate house and electronica elements into their music, but also for playing a part in the revival of disco and electro-infused music in the late 2000s.[67] His mother's death in November 2007[68] and the end of his engagement to Alexis Phifer[69] profoundly affected West, who set off for his 2008 Glow in the Dark Tour shortly thereafter.[70]",kanye.txt,True
West performing in 2008,kanye.txt,True
"Recorded mostly in Honolulu, Hawaii in three weeks,[71] West announced his fourth album, 808s & Heartbreak, at the 2008 MTV Video Music Awards, where he performed its lead single, ""Love Lockdown"". Music audiences were taken aback by the uncharacteristic production style and the presence of Auto-Tune, which typified the pre-release response to the record.[72] 808s & Heartbreak was released by Island Def Jam in November 2008.[73][74] Upon its release, the lead single ""Love Lockdown"" debuted at number three on the Billboard Hot 100,[75] while follow-up single ""Heartless"" debuted at number four.[76] While it was criticized prior to release, 808s & Heartbreak is considered to have had a significant effect on hip-hop music, encouraging other rappers to take more creative risks with their productions.[77]",kanye.txt,True
"While Taylor Swift was accepting her award for Best Female Video at the 2009 MTV Video Music Awards, West went on stage and grabbed the microphone from her to proclaim that Beyoncé deserved the award instead. He was subsequently removed from the remainder of the show for his actions.[78][79][80] West was criticized by various celebrities for the outburst,[78][81][82][83] and by President Barack Obama, who called West a ""jackass"".[84][85][86][87] The incident sparked a large influx of Internet photo memes.[88] West subsequently apologized,[82][89] including personally to Swift.[90][91] However, in a November 2010 interview, he seemed to recant his past apologies, describing the act at the 2009 awards show as ""selfless"".[92][93]",kanye.txt,True
"2010–2012: My Beautiful Dark Twisted Fantasy, Watch the Throne, and Cruel Summer",kanye.txt,True
"Main articles: My Beautiful Dark Twisted Fantasy, Watch the Throne, and Cruel Summer (GOOD Music album)",kanye.txt,True
"Following the highly publicized incident, West took a brief break from music and threw himself into fashion, only to hole up in Hawaii for the next few months writing and recording his next album.[94] Importing his favorite producers and artists to work on and inspire his recording, West kept engineers behind the boards 24 hours a day and slept only in increments. Noah Callahan-Bever, a writer for Complex, was present during the sessions and described the ""communal"" atmosphere as thus: ""With the right songs and the right album, he can overcome any and all controversy, and we are here to contribute, challenge, and inspire.""[94] A variety of artists contributed to the project, including close friends Jay-Z, Kid Cudi and Pusha T, as well as collaborations with artists including Justin Vernon of Bon Iver and Gil Scott Heron.[95]",kanye.txt,True
West at the SWU Music & Arts Festival in Brazil in 2011,kanye.txt,True
"My Beautiful Dark Twisted Fantasy, West's fifth studio album, was released in November 2010 to widespread acclaim from critics, many of whom considered it his best work and said it solidified his comeback.[96] In stark contrast to his previous effort, which featured a minimalist sound, Dark Fantasy adopts a maximalist philosophy and deals with themes of celebrity and excess.[53] The record included the international hit ""All of the Lights"", and Billboard hits ""Power"", ""Monster"", and ""Runaway"",[97] the latter of which accompanied a 35-minute film of the same name directed by and starring West.[98] During this time, West initiated the free music program GOOD Fridays through his website, offering a free download of previously unreleased songs each Friday, a portion of which were included on the album. This promotion ran from August to December 2010.[99] Dark Fantasy went on to go platinum in the United States,[100] but its omission as a contender for Album of the Year at the 54th Grammy Awards was viewed as a ""snub"" by several media outlets.[101]",kanye.txt,True
"2011 saw West embark on a festival tour to commemorate the release of My Beautiful Dark Twisted Fantasy performing and headlining numerous festivals including; SWU Music & Arts, Austin City Limits Music Festival, Oya Festival, Flow Festival, Live Music Festival, The Big Chill, Essence Music Festival, Lollapalooza and Coachella which was described by The Hollywood Reporter as ""one of greatest hip-hop sets of all time"",[102] West released the collaborative album Watch the Throne with Jay-Z in August 2011. By employing a sales strategy that released the album digitally weeks before its physical counterpart, Watch the Throne became one of the few major label albums in the Internet age to avoid a leak.[103][104] ""Niggas in Paris"" became the record's highest-charting single, peaking at number five on the Billboard Hot 100.[97] The co-headlining Watch the Throne Tour kicked off in October 2011 and concluded in June 2012.[105] In 2012, West released the compilation album Cruel Summer, a collection of tracks by artists from West's record label GOOD Music.",kanye.txt,True
2013–2015: Yeezus and the Yeezus Tour,kanye.txt,True
Main articles: Yeezus and The Yeezus Tour,kanye.txt,True
"Sessions for West's sixth solo effort begin to take shape in early 2013 in his own personal loft's living room at a Paris hotel.[106] Determined to ""undermine the commercial"",[107] he once again brought together close collaborators and attempted to incorporate Chicago drill, dancehall, acid house, and industrial music.[108] Primarily inspired by architecture,[106] West's perfectionist tendencies led him to contact producer Rick Rubin fifteen days shy of its due date to strip down the record's sound in favor of a more minimalist approach.[109] Initial promotion of his sixth album included worldwide video projections of the album's music and live television performances.[110][111] Yeezus, West's sixth album, was released June 18, 2013, to rave reviews from critics.[112] It became his sixth consecutive number one debut, but also marked his lowest solo opening week sales.[113]",kanye.txt,True
West on the Yeezus Tour in 2013,kanye.txt,True
"In September 2013, West announced he would be headlining his first solo tour in five years, to support Yeezus, with fellow American rapper Kendrick Lamar accompanying him as a supporting act.[114][115] The tour was met with rave reviews from critics.[116] Rolling Stone described it as ""crazily entertaining, hugely ambitious, emotionally affecting (really!) and, most importantly, totally bonkers"".[116] Writing for Forbes, Zack O'Malley Greenburg praised West for ""taking risks that few pop stars, if any, are willing to take in today's hyper-exposed world of pop"", describing the show as ""overwrought and uncomfortable at times, but [it] excels at challenging norms and provoking thought in a way that just isn't common for mainstream musical acts of late"".[117] West subsequently released a number of singles featuring Paul McCartney, including ""Only One""[118] and ""FourFiveSeconds"", also featuring Rihanna.[119]",kanye.txt,True
"In November 2013, West stated that he was beginning work on his next studio album, hoping to release it by mid-2014,[120] with production by Rick Rubin and Q-Tip.[121] Having initially announced a new album entitled Yeezus II slated for a 2014 release, West announced in March 2015 that the album would instead be tentatively called So Help Me God.[122] In May 2015, West was awarded an honorary doctorate by the School of the Art Institute of Chicago for his contributions to music, fashion, and popular culture.[123][124][d] The next month, West headlined at the Glastonbury Festival in the UK, despite a petition signed by almost 135,000 people against his appearance.[126] Another petition aimed to block West from headlining the 2015 Pan American Games, garnering 50,000 supporters.[127]",kanye.txt,True
2016–2017: The Life of Pablo and tour cancellation,kanye.txt,True
Main article: The Life of Pablo,kanye.txt,True
"West announced in January 2016 that SWISH would be released on February 11, and later that month, released new songs ""Real Friends"" and a snippet of ""No More Parties in LA"" with Kendrick Lamar. On January 26, 2016, West revealed he had renamed the album from SWISH to Waves.[128] In the weeks leading up to the album's release, West became embroiled in several Twitter controversies.[129] Several days ahead of its release, West again changed the title, this time to The Life of Pablo.[130][131] On February 11, West premiered the album at Madison Square Garden as part of the presentation of his Yeezy Season 3 clothing line.[132] Following the preview, West announced that he would be modifying the tracklist once more before its release to the public.[133] He released the album exclusively on Tidal on February 14, 2016, following a performance on SNL.[134][135] Following its release, West continued to tinker with mixes of several tracks, describing the work as ""a living breathing changing creative expression""[136] and proclaiming the end of the album as a dominant release form.[137] Despite West's earlier comments, in addition to Tidal, the album was released through several other competing services starting in April.[138]",kanye.txt,True
West on the Saint Pablo Tour in 2016,kanye.txt,True
"In February 2016, West stated on Twitter that he was planning to release another album in the summer of 2016, tentatively called Turbo Grafx 16 in reference to the 1990s video game console of the same name.[139][140] In June 2016, West released the collaborative lead single ""Champions"" off the GOOD Music album Cruel Winter, which has yet to be released.[141][142] Later that month, West released a controversial video for ""Famous"", which depicted wax figures of several celebrities (including West, Kardashian, Taylor Swift, businessman and then-presidential candidate Donald Trump, comedian Bill Cosby, and former president George W. Bush) sleeping nude in a shared bed.[143]",kanye.txt,True
"In August 2016, West embarked on the Saint Pablo Tour in support of The Life of Pablo.[144] The performances featured a mobile stage suspended from the ceiling.[144] West postponed several dates in October following the Paris robbery of several of his wife's effects.[145] On November 21, 2016, West cancelled the remaining 21 dates on the Saint Pablo Tour, following a week of no-shows, curtailed concerts and rants about politics.[146] He was later admitted for psychiatric observation at UCLA Medical Center.[147][148] He stayed hospitalized over the Thanksgiving weekend because of a temporary psychosis stemming from sleep deprivation and extreme dehydration.[149] Following this episode West took an 11-month break from posting on Twitter and the public in general.[150]",kanye.txt,True
2017–2019: Ye and the Wyoming Sessions,kanye.txt,True
Main articles: Ye (album) and Kids See Ghosts (album),kanye.txt,True
"See also: Daytona (album), Nasir (album), and K.T.S.E.",kanye.txt,True
"It was reported in May 2017 that West was recording new music in Jackson Hole, Wyoming, with a wide range of collaborators.[151][152] In April 2018, West announced plans to write a philosophy book entitled Break the Simulation,[153] later clarifying that he was sharing the book ""in real time"" on Twitter and began posting content that was likened to ""life coaching"".[154] Later that month, he also announced two new albums, a solo album and self-titled collaboration with Kid Cudi under the name Kids See Ghosts, both of which would be released in June.[155] Additionally, he revealed he would produce upcoming albums by GOOD Music label-mates Pusha T and Teyana Taylor, as well as Nas.[156] Shortly thereafter, West released the non-album singles ""Lift Yourself"" and ""Ye vs. the People"", in which he and T.I. discussed West's support of Donald Trump.[157]",kanye.txt,True
"Pusha T's Daytona, ""the first project out of Wyoming"", was released in May to critical acclaim, although the album's artwork—a photograph of deceased singer Whitney Houston's bathroom that West paid $85,000 to license—attracted some controversy.[158][159] The following week, West released his eighth studio album, Ye. West has suggested that he scrapped the original recordings of the album and re-recorded it within a month.[160] The week after, West released a collaborative album with Kid Cudi, titled Kids See Ghosts, named after their group of the same name. West also completed production work on Nas' Nasir[161] and Teyana Taylor's K.T.S.E., which were released in June 2018.[162]",kanye.txt,True
